,comments,sentiments
0,"рджреБрд░реНрд▓рдн рдХреНрд▓рд┐рдкрд╣рд░реВ рдЦреЛрдЬреЗрд░ рд░рд╛рдореНрд░реЛ рдкреНрд░рд╕реНрддреБрддрд┐ рд╕рд╣рд┐рдд рднрд┐рдбрд┐рдпреЛ рдмрдирд╛рдЙрдиреБ рднрдПрдХреЛ рд░рд╣реЗрдЫред рддреНрдпрд╕рдХрд╛ рд▓рд╛рдЧрд┐ рдзрдиреНрдпрд╡рд╛рджред рдореЗрд░реЛ рдЖрдлреНрдиреИ рдЕрдиреБрд╕рдиреНрдзрд╛рди рдкрдирд┐ рдпреА┬ард╡рд┐рд╖рдп рдУрд░реАрдкрд░рд┐ рдиреИ рдШреБрдореЗрдХреЛрд▓реЗ рдпреЛ рднрд┐рдбрд┐рдпреЛрдорд╛ рдЪрд╛рд╣рд┐рдБ рдХреЗрд╣реА рдорд╣рддреНрддреНрд╡рдкреВрд░реНрдг рд╡рд┐рд╖рдпрд╣рд░реВ рдЫреБрдЯреЗрдХрд╛ рд░рд╣реЗрдЫрдиреН рднрдиреНрдиреЗ рд▓рд╛рдЧреНрдпреЛред рдЬрд╕реНрддреИ: ┬а┬а┬а┬а┬а┬а┬а
┬а
рез- рднрд┐рдбрд┐рдпреЛрдорд╛ рднрдирд┐рдПрдЬрд╕реНрддреИ рдХрдЯрд╡рд╛рд▓ рдПрдХрджрдо рдорд╣рддреНрддреНрд╡рд╛рдХрд╛рдЩреНрдХреНрд╖реА рдд рдерд┐рдП рдиреИ рдЙрдирд▓рд╛рдИ рдиреЗрдкрд╛рд▓рдорд╛ рднрдЗрд░рд╣реЗрдХреЛ рд░рд╛рдЬрдиреИрддрд┐рдХ рдкрд░рд┐рд╡рд░реНрддрди рдкрдЯрдХреНрдХреИ рдорди рдкрд░реЗрдХреЛ рдерд┐рдПрдиред рдЬрдЩреНрдЧреА рдЕрдбреНрдбрд╛рдорд╛ рдмрд╕реЗрд░ рдЙрдирд▓реЗ рдЕрдиреЗрдХ (рдЕ)рд░рд╛рдЬрдиреИрддрд┐рдХ рдХреНрд░рд┐рдпрд╛рдХрд▓рд╛рдк рдЧрд░рд┐рд░рд╣реЗрдХрд╛ рдерд┐рдПред рдордзреЗрд╕реА рд╕рдореБрджрд╛рдпрд▓рд╛рдИ рдкрдирд┐ рд╕реЗрдирд╛рдорд╛ рдкреНрд░рд╡реЗрд╢ рджрд┐рдиреЗ рд╕рд░рдХрд╛рд░рдХреЛ рддрдпрд╛рд░реАрдХреЛ рдЙрдирд▓реЗ рд╡рд┐рд░реЛрдз рдЧрд░реЗрдХрд╛ рдерд┐рдПред рдЕрдиреНрддрд░рд┐рдо рд╕рдВрд╡рд┐рдзрд╛рдирдорд╛ рдХреЗ-рдХреЗ рд░рд╛рдЦреНрдиреБ рдкрд░реНрдЫ рд░ рдкрд░реНрджреИрди рднрдиреЗрд░ рд╕рд░рдХрд╛рд░рд▓рд╛рдИ рд▓рд┐рд╕реНрдЯ рдиреИ рдкрдард╛рдЗрджрд┐рдПрдХрд╛ рдерд┐рдПред рдПрдХ рдЬрдирд╛ рдорд╛рдУрд╡рд╛рджреА рд╕реЗрдирд╛┬ардкрдирд┐ рдиреЗрдкрд╛рд▓реА рд╕реЗрдирд╛рдорд╛ рд╕рдорд╛рдпреЛрдЬрди рдЧрд░реНрдиреБрд╣реБрдиреНрди рднрдиреНрдиреЗ рдХрдЯрд╡рд╛рд▓рдХреЛ рдЕрддрд┐ рдЕрдиреБрджрд╛рд░ рдордд рдерд┐рдпреЛред┬а

реи- рдЕрдкреНрд░рд┐рд▓ реирежрежреп рдорд╛ рд░рд┐рдЯрд╛рдпрд░ рд╣реБрдиреИ рд▓рд╛рдЧреЗрдХрд╛ рдЖрда рдЬрдирд╛ рдмрд┐рдЧреНрд░реЗрдбрд┐рдпрд░ рдЬрдирд░рд▓рд╣рд░реБрд▓рд╛рдИ рдореНрдпрд╛рдж рдердкреНрди рдХрдЯрд╡рд╛рд▓рд▓реЗ рдкреНрд░рд╕реНрддрд╛рд╡ рдЧрд░реЗрдХрд╛ рдерд┐рдПред рдЙрдиреАрд╣рд░реВрдХреЛ рдореНрдпрд╛рдж рдердкреНрдиреБ рд╡рд╛ рдирдердкреНрдиреБ рд╕рд░рдХрд╛рд░рдХреЛ рдкреВрд░реНрдг рдЕрдзрд┐рдХрд╛рд░рдХреЛ рд╡рд┐рд╖рдп рдерд┐рдпреЛред рд╕рд░рдХрд╛рд░рд▓реЗ рдореНрдпрд╛рдж рдирдердкреЗрдкрдЫрд┐ рдЙрдирд▓реЗ рддреА рдЬрдирд░рд▓рд╣рд░реВрд▓рд╛рдИ рдЬрди рдирд┐рд░реНрд╡рд╛рдЪрд┐рдд рд╕рд░рдХрд╛рд░рдХреЛ рдирд┐рд░реНрдгрдп рдорд╛рдиреНрди рдмрд╛рдзреНрдп рдЧрд░рд╛рдЙрдиреБрдХреЛ рд╕рд╛рдЯреЛ 'рд╕рд░рдХрд╛рд░рдХреЛ рдирд┐рд░реНрдгрдпрдХреЛ рдорддрд▓рдм рдирдЧрд░реА рдХрд╛рдордорд╛ рдлрд░реНрдХрдиреБ'┬арднрдиреЗрд░ 'рдердореМрддреА' рджрд┐рдПрдХрд╛ рдерд┐рдПред рдЬреБрди рдЖрдлреИрдБрдорд╛ рдЧрд░реНрди рдирд╣реБрдиреЗ рдХрд╛рдо рдерд┐рдпреЛред

рей- рд░рд╛рдордмрд╣рд╛рджреБрд░ рдерд╛рдкрд╛ 'рдмрд╛рджрд▓' рд░рдХреНрд╖рд╛рдордиреНрддреНрд░реА рднреИрд╕рдХреЗрдкрдЫрд┐ рдЙрдирд▓реЗ рд╕рдореНрдмрдиреНрдз рд╕реБрдзрд╛рд░реНрди рдХреЗрд╣реА рдкреНрд░рдпрд╛рд╕ рдЧрд░реЗрдХрд╛ рдерд┐рдП, рддрд░ рддреНрдпреЛ рд╕рдлрд▓ рд╣реБрди рд╕рдХреЗрдиред рдкрдЫрд┐ рдЙрдирд▓реЗ рд░рдХреНрд╖рд╛ рдордиреНрддреНрд░реАрдХреЛ рд░реВрдкрдорд╛ рдХрдЯрд╡рд╛рд▓рд▓рд╛рдИ рд╕реНрдкрд╖реНрдЯреАрдХрд░рдг рдкрдирд┐ рд╕реЛрдзреЗред рддрд░ рдХрдЯрд╡рд╛рд▓рд▓реЗ рддреНрдпреЛ рд╕реНрдкрд╖реНрдЯреАрдХрд░рдгрдХреЛ рдЬрд╡рд╛рдл рдХрд╣рд┐рд▓реНрдпреИ рдлрд░реНрдХрд╛рдПрдирдиреНред рдорд╛рдУрд╡рд╛рджреА рдиреЗрддреГрддреНрд╡рдХреЛ рддреНрдпреЛ рд╕рд░рдХрд╛рд░рд▓рд╛рдИ рдХрдЯрд╡рд╛рд▓рд▓реЗ рдХреБрдиреИ рдЯреЗрд░рдкреБрдЫрд░ рдирд▓рд╛рдПрдХреЛ рдШрдЯрдирд╛рдХреНрд░рдорд▓реЗ рджреЗрдЦрд╛рдЙрдБрдЫред┬а

рек- рдЬрдм рдкреНрд░рдЪрдгреНрдб рд╕рд░рдХрд╛рд░рд▓реЗ рдХрдЯрд╡рд╛рд▓рд▓рд╛рдИ рдмрд░реНрдЦрд╛рд╕реНрдд рдЧрд░реНрдиреЗ рдирд┐рд░реНрдгрдп рдЧрд░реНтАНрдпреЛ, рд╕реЛрдЭреЛ рдмрд╛рдЯреЛ рдд рд╕рд░реНрд╡реЛрдЪреНрдЪ рдЕрджрд╛рд▓рдд рдЬрд╛рдиреБ рд╣реБрдиреНрдереНрдпреЛ, рддрд░ рдХрдЯрд╡рд╛рд▓рд▓реЗ рддреНрдпрд╕реЛ рдЧрд░реЗрдирдиреНред рдЙрдирд▓реЗ рдЬрдВрдЧрд┐рдЕрдбреНрдбрд╛рдмрд╛рдЯ рднрд╛рд░рддрддрд┐рд░ рд░ рдЕрдиреНрдп рд╡рд┐рджреЗрд╢реА рд╢рдХреНрддрд┐рдХреЗрдиреНрджреНрд░рддрд┐рд░ рд╕рдореНрдкрд░реНрдХ рдЧрд░реНрди рдерд╛рд▓реЗ (рдЬреБрди рдЙрдирд▓реЗ рдЖрдлреНрдиреЛ рдЖрддреНрдордХрдерд╛┬ардореИ рд╕реНрд╡реАрдХрд╛рд░ рдЧрд░реЗрдХрд╛ рдЫрдиреНред) рдХрдЯрд╡рд╛рд▓рдХреЛ рдорд╛рдУрд╡рд╛рджреА рд╡рд┐рд░реЛрдзреА рдЫрд╡рд┐ рднрд╛рд░рддрд▓рд╛рдИ рдкрд╣рд┐рд▓реЗрджреЗрдЦрд┐ рдиреИ рдорди рдкрд░реЗрдХреЛ рдерд┐рдпреЛред режремрек рд╕рд╛рд▓рдкрдЫрд┐ рдЬрд╕рд░реА рдорд╛рдУрд╡рд╛рджреАрд╣рд░реВ рдиреЗрдкрд╛рд▓рдХреЛ рд░рд╛рдЬрдиреАрддрд┐рдорд╛ рдкрд╣рд┐рд▓реЛ рд╢рдХреНрддрд┐рдХреЛ рд░реВрдкрдорд╛ рдЙрджрд╛рдПрдХрд╛ рдерд┐рдП, рддреНрдпреЛ рднрд╛рд░рддрд▓рд╛рдИ рд░реБрдЪрд┐рд░рд╣реЗрдХреЛ рдерд┐рдПрдиред рдкрд╣рд┐рд▓реЛ рд╢рдХреНрддрд┐ рдмрдиреЗрдкрдЫрд┐ рдорд╛рдУрд╡рд╛рджреАрд╣рд░реВрдХреЛ рдкрдирд┐ рдЕрддрд┐ рдЖрддреНрдорд╡рд┐рд╢реНрд╡рд╛рд╕ рд░ рдорд╣рддреНрддреНрд╡рд╛рдХрд╛рдЩреНрдХреНрд╖реА рдЪрд░рд┐рддреНрд░ рдкреНрд░рдХрдЯ рднрдПрдХреЛ рдерд┐рдпреЛред рд╕реЗрдирд╛рдкрддрд┐ рдкреНрд░рдХрд░рдгрдорд╛рд░реНрдлрдд рдорд╛рдУрд╡рд╛рджреАрд▓рд╛рдИ 'рд╕рдмрдХ' рд╕рд┐рдХрд╛рдЙрдиреЗ рдЕрд╡рд╕рд░ рднрд╛рд░рддрд▓реЗ рдкреНрд░рд╛рдкреНрдд рдЧрд░реЗрдХреЛ рдерд┐рдпреЛ, рдЬрд╕рдХреЛ рдЙрд╕рд▓реЗ рднрд░рдкреБрд░ рдкреНрд░рдпреЛрдЧ рдЧрд░реНтАНрдпреЛред┬а

рел- рддреНрдпреЛ рдмреЗрд▓рд╛рдХрд╛ рднрд╛рд░рддреАрдп рд╕реЗрдирд╛ рдкреНрд░рдореБрдЦ рдХрдЯрд╡рд╛рд▓рдХрд╛ рд╕рд╣рдкрд╛рдареА рдерд┐рдП рд░ рднрд╛рд░рддреАрдп рд░рд╛рдЬреНрдп рд╕рдВрдпрдиреНрддреНрд░рд╕рдВрдЧ рдЙрдирдХреЛ рд░рд╛рдореНрд░реЛ рдЙрдардмрд╕ рдерд┐рдпреЛред рднрд╛рд░рддрдХреИ рдЖрдбрдорд╛ рдХрдЯрд╡рд╛рд▓рд▓реЗ рдиреЗрдкрд╛рд▓реА рд╕рд░рдХрд╛рд░рдХреЛ рдЙрдкреЗрдХреНрд╖рд╛ рдЧрд░реЗрдХрд╛ рдерд┐рдПред рдЬрдм рдкреНрд░рдЪрдгреНрдбрд▓реЗ рдХрдЯрд╡рд╛рд▓рд▓рд╛рдИ рдмрд░реНрдЦрд╛рд╕реНрдд рдЧрд░реЗ, рдиреЗрдкрд╛рд▓рдХрд╛ рд▓рд╛рдЧрд┐ рднрд╛рд░рддреАрдп рд░рд╛рдЬрджреВрдд рд░рд╛рдХреЗрд╢ рд╕реБрдж рд▓реЗ реирек рдШрдгреНрдЯрд╛рдорд╛ реи рдЪреЛрдЯрд┐ рд░рд╛рд╖реНрдЯреНрд░рдкрддрд┐ рдпрд╛рджрд╡рд▓рд╛рдИ рднреЗрдЯреЗрд░ рддреНрдпреЛ рдирд┐рд░реНрдгрдп рдЦрд╛рд░реЗрдЬ рдЧрд░реНрди рджрдмрд╛рдм рджрд┐рдПрдХрд╛ рдерд┐рдПред рддреНрдпреЛ рдмреЗрд▓рд╛рдХрд╛ рднрд╛рд░рддреАрдп рдмрд┐рджреЗрд╢рдордиреНрддреНрд░реА рдкреНрд░рдгрд╡ рдореБрдЦрд░реНрдЬреАрд▓реЗ рдд рд░рд╛рд╖реНрдЯреНрд░рдкрддрд┐ рдпрд╛рджрд╡рд▓рд╛рдИ рдлреЛрди рдЧрд░реЗрд░реИ рдХрдЯрд╡рд╛рд▓рдХреЛ рдмрд░реНрдЦрд╛рд╕реНрддрдХреАрдХреЛ рдирд┐рд░реНрдгрдп рд░рд╛рд╖реНрдЯреНрд░рдкрддрд┐рд▓реЗ рд╕рджрд░ рдЧрд░реЗ рдкрдирд┐ рдХрдЯрд╡рд╛рд▓рд▓реЗ рдХреБрдиреИ рд╣рд╛рд▓рддрдорд╛ рдЬрдВрдЧрд┐рдЕрдбреНрдбрд╛ рдЫреЛрдбреЗрд░ рдирд╣рд┐рдБрдбреНрдиреЗ рдзрдореНрдХреА рджрд┐рдПрдХрд╛ рдерд┐рдП рднрдиреЗрд░ рднрдирд┐рдиреНрдЫред рд╕рдиреН реирежрезрен рдорд╛ рджрд┐рдПрдХреЛ рдПрдХ рдЕрдиреНрддрд░реНрд╡рд╛рд░реНрддрд╛рдорд╛ рдкреВрд░реНрд╡ рд░рд╛рд╖реНрдЯреНрд░рдкрддрд┐ рдпрд╛рджрд╡ рднрдиреНрдЫрдиреН:┬а ""рдПрдЙрдЯрд╛ рд╡рд┐рджреЗрд╢реА рд╢рдХреНрддрд┐рд▓реЗ рдорд▓рд╛рдИ рдЬрдирд░рд▓ рдХрдЯрд╡рд╛рд▓рд▓рд╛рдИ рд╕реНрдЯреЗ рдЕрд░реНрдбрд░ рджрд┐рдиреЗ рд░ рджреЗрд╢рдорд╛ рд╕рдЩреНрдХрдЯрдХрд╛рд▓ рдШреЛрд╖рдгрд╛ рдкрдирд┐ рдЧрд░реЛрд╕реН рднрдиреНрдиреЗ рдЪрд╛рд╣рдиреНрдереЗред рддрд░, рдореИрд▓реЗ рд╕рдЩреНрдХрдЯрдХрд╛рд▓ рдШреЛрд╖рдгрд╛ рдЧрд░реНрди рдЕрд╕реНрд╡реАрдХрд╛рд░ рдЧрд░реЗрдБред"" 

рем- рдорд╛рдУрд╡рд╛рджреАрд╣рд░реВ рдХрдЯрд╡рд╛рд▓рд▓рд╛рдИ рдмрд░реНрдЦрд╛рд╕реНрдд рдЧрд░реЗрд░ рдиреЗрдкрд╛рд▓рдорд╛ рдЕрдзрд┐рдирд╛рдпрдХрд╡рд╛рдж рд▓рд╛рдЧреБ рдЧрд░реНрди рдЪрд╛рд╣рдиреНрдЫрдиреН рднрдиреЗрд░ рдЬреБрди рднрд╛рд╖реНрдп рдирд┐рд░реНрдорд╛рдг рдЧрд░рд┐рдпреЛ, рддреНрдпрд╕рдорд╛ рдкрдирд┐ рдЦрд╛рд╕реИ рд╕рддреНрдпрддрд╛ рдЫреИрдиред рдХрд╛рдБрдЧреНрд░реЗрд╕, рдПрдорд╛рд▓реЗрдЬрд╕реНрддрд╛ рдкрд╛рд░реНрдЯреАрд╣рд░реВ, рдиреЗрдкрд╛рд▓реА рд╕реЗрдирд╛рдХреЛ рддреНрдпрддреНрд░реЛ рд╢рдХреНрддрд┐ рд░ рдкреНрд░рддрд┐рдХреБрд▓ рд╡рд┐рджреЗрд╢реА рдкрд░рд┐рд╡реЗрд╢рдХрд╛ рдмрд┐рдЪ рдкреНрд░рдЪрдгреНрдбрдХреЛ рдЕрдзрд┐рдирд╛рдпрдХрд╡рд╛рдж рел рджрд┐рди рдкрдирд┐ рдЯрд┐рдХреНрджреИрди рднрдиреНрдиреЗ рдкреНрд░рдЪрдгреНрдбрд▓рд╛рдИ рдерд╛рд╣рд╛ рдирд╣реБрдиреЗ рдХреБрд░рд╛ рдерд┐рдПрдиред реирекреж рд╡рд░реНрд╖рдХреЛ рд░рд╛рдЬрддрдиреНрддреНрд░ рдлрд╛рд▓реЗрдХреЛ рез рд╡рд░реНрд╖рдорд╛ рдиреЗрдкрд╛рд▓реА рдЬрдирддрд╛рд▓реЗ рдорд╛рдУрд╡рд╛рджреА рдЕрдзрд┐рдирд╛рдпрдХрд╡рд╛рдж рд╕реНрд╡реАрдХрд╛рд░ рдЧрд░реНрдереЗ рднрдиреЗрд░ рд╕реЛрдЪреНрдиреБ рдкрдирд┐ рд╣рд╛рд╕реНрдпрд╛рд╕реНрдкрдж рд╣реЛред рдорд╛рдУрд╡рд╛рджреАрд▓реЗ рдкрдХреНрдХреИ рдкрдирд┐ рд╕реЗрдирд╛ рд╕рдорд╛рдпреЛрдЬрди рдЧрд░реНрджрд╛ рдЖрдлреНрдирд╛ рдХреЗрд╣реА рдзреЗрд░реИ рд▓рдбрд╛рдХреБрд╣рд░реВ рдШреБрд╕рд╛рдЙрди рд╕рдХреНрдереНрдпреЛ, рддрд░ рддреНрдпреЛ рднрдиреНрджрд╛ рдмрдврд┐ рдЦрд╛рд╕реИ рдХреЗрд╣реА рд╣реБрдиреНрдереНрдпреЛ рдЬрд╕реНрддреЛ рдЪрд╛рд╣рд┐рдБ рд▓рд╛рдЧреНрджреИрдиред рдЕрдзрд┐рдирд╛рдпрдХрд╡рд╛рдж рд▓рд╛рджреНрдиреЗ рдкреНрд░рдпрд╛рд╕ рдЧрд░реЗрдХреЛ рднрдП рдХрд╣рд┐рд▓реЗ рдирдЙрдареНрдиреЗ рдЧрд░рд┐ рдорд╛рдУрд╡рд╛рджреАрд╣рд░реБ рдиреИ рд╕рд┐рджреНрджрд┐рдиреНрдереЗред  ┬а

рен- рдХрдЯрд╡рд╛рд▓рдХреЛ рд╡реНрдпрд╛рдкрдХ рдЕрд╕рд╣рдпреЛрдЧрдХрд╛ рдмрд╛рдмрд╛рдЬреБрдд рдкрдирд┐ рдкреНрд░рдЪрдгреНрдбрд▓реЗ рдЙрдирд▓рд╛рдИ рей-рек рдорд╣рд┐рдирд╛ рдердк рдЭреЗрд▓реЗрдХреЛ рднрдП рдХрдЯрд╡рд╛рд▓ рдд рд░рд┐рдЯрд╛рдпрд░ рд╣реБрдиреНрдереЗ рдиреИ, рдкреНрд░рдЪрдгреНрдбрдХреЛ рд╕рд░рдХрд╛рд░ рдкрдирд┐ рдмрдЪреНрдереНрдпреЛред рд╕рдВрд╡реИрдзрд╛рдирд┐рдХ рд░реВрдкрдорд╛ рд╕рд╣реА рднрдП рдкрдирд┐ рд╡реНрдпрд╡рд╣рд╛рд░рд┐рдХ рд░ рд░рд╛рдЬрдиреИрддрд┐рдХ рд░реВрдкрдорд╛ рдкреНрд░рдЪрдгреНрдбрдХреЛ рддреНрдпреЛ рдХрд╛рдБрдЪреЛ рдирд┐рд░реНрдгрдп рдерд┐рдпреЛред┬а рдХрдЯрд╡рд╛рд▓рд▓рд╛рдИ рдЬрд╕рд░реА рдкрдирд┐ рд╣рдЯрд╛рдЙрдиреБрдкрд░реНрдЫ рднрдиреНрдиреЗрдорд╛ рддреНрдпреЛ рдмреЗрд▓рд╛рдХреЛ рдорд╛рдУрд╡рд╛рджреА рдкрд╛рд░реНрдЯреАрдорд╛ рдЕрд▓рд┐рдХ рд╣рд╛рд░реНрдбрд▓рд╛рдЗрдирд░ рдорд╛рдирд┐рдиреЗ рдореЛрд╣рди рд╡реИрджреНрдп 'рдХрд┐рд░рдг', рдиреЗрддреНрд░ рд╡рд┐рдХреНрд░рдо рдЪрдиреНрдж 'рд╡рд┐рдкреНрд▓рд╡', рд░ рд░рд╛рдордмрд╣рд╛рджреБрд░ рдерд╛рдкрд╛ 'рдмрд╛рджрд▓' рд▓рдЧрд╛рдпрдд рдерд┐рдПред",1
1,I see potential in this channel to become the most trusted youtube channel of Nepal.,1
2,Past 2-3 years i was only watching dhruv rathee to gain such kind of knowledge on any particular topics but he is Indian . He explains Indian politics on majority. I never found  any from my country then i saw this channel. Really brother you explained it very clearly.я╕Пя╕П I am addicted on you now.,1
3,"This is True rise of Genuine Content creators in Nepal, hats off bro, keep it up cause Young Generation needs to be aware of this types of incident",1
4,"Very well presented !!
This is what new generation Nepali youths are expected to be.

Hats off to your research and dedication ",1
5,"Amazing synthesis of the whole situation you guys ! I was part of the Maoist student movement back then , we were all infuriated with Rumngad and President back then . But in hindsight, Nepal avoided a big disaster.",1
6,Thank you for portraying history to the youth who are devoid and confused about the political history of Nepal. You are doing a wonderful job,1
7,"Thank you brother 
YouтАЩre providing alot of knowledge to learn about our own countryЁЯЗ│ЁЯЗ╡
Really happy to see content creators like you",1
8,"US : Johnny Harris
India : Soch, Dhruv Rathee
Nepal : The Nepali Comment
I really appreciate your amazing content. I hope this will help you to keep going and to keep growing",1
9,"Most underrated YouTuber of Nepal.. 
Huge respect to you sir я╕П",1
10,"@TheNeplaiComment ..bro you should host a live QnA sometimes. Would be fun to discuss and learn the Nepalese history. Talking about which, will you be making videos on the Rana Shashan, Prithvi Narayan Shah times etc... Why not a series on the major Nepalese events?? Much Respect !!",1
11,I used to read the book of rukmangud katwal when i was in 9 class.great book and he is also great person.great analysis brother anywayя╕Пя╕Пя╕П,1
12,Your content is truly a gem. Thanks for presenting various facts in informative way,1
13,we appreciate your efforts keep inspiring and enlightening the youths,1
14,Can I suggest you to put cc/subtitles in your videos to make it more accessible to people with hard of hearing? Believe me there is a large community in need of it here in Nepal too!,1
15,I am watching you since your 20k subscribers and I really appreciate your efforts brother keep making this kind of videos so that we can get know the hidden and unknown truth,1
16,"Wow i am truly amazed that how clear is your message to the audience. I have been watching your videos since beginning and youтАЩve come really far and your quality is admirable.Congratulations to you, keep growing.",1
17,Your efforts of making documentary  like videos  are great!!.. keep enlighten!! .. keep rising!!,1
18,"1. In depth story
2. The Nepali Comment
3. Nepali Gyan 
4. Ramdom Nepali 
5. Misguided Nepal ",1
19,Huge respect to all the team members,1
20,Huge respect to you brother ,1
21,"You people are doing awesome!  
Hats off to the team ! 
Specially Dipesh vai ",1
22,Good job. A well prepared informative video. Massive respect to the creator.,1
23,Deepesh and the Nepali Comment Team - Kudos to you guys for such brilliant content time and again ...,1
24,I love the way you present and the duration of the video is  incerese day by day ,1
25,The quality in your contains are so overwhelmed keep the good work bro я╕П,1
26,"staying updated on your each and every contents. thanks for your comprehensive research, keep commenting we're always on the other side to hear you.",1
27,"I believe there must be a large series or maybe just a  movie regarding the history of Nepal. Excellent work bro .
Just be safe who knows what they are planning.",1
28,"In war, opposite side always does whatever necessary to win. We know the story of Great War Mahabharat. Its important to do duty/Karma and fight for what your believe
Whatever political ideology you have, you cannot deny Chief Katawal stood-up and did his duty whole heartedly and with passion. Chief Rookmangud Katwal is in his 80s and struggling to maintain his health. Prayers for his good health and peaceful retired life. 

As long as Nepal is between India and China, And foreign actor with vested interested have agenda for Nepal, there will only be change in character, story will be same. There will always be power struggle and you will have your heroes and villian to choose from.

The Nepali comment you guys are going great job. Keep it up.",1
29,"Your work is very qualitative, just loved it 
Kudos to you",1
30,Rookmantak katwal  sir i think we need more videos on his habbit and his idea man after this video respect to him ...and thanks to nepali comment for this perfect video ,1
31,Nepalese version of Johnny Harris. Really appreciate your work brother.,1
32,"Dear so called podcasters, content creators and other youtubers learn how it's done. What a research and presentation of the content. Hats off!",1
33,Seriously gold content ,1
34,"Literally, amazed by your content finally we have got our johnny",1
35,This is awesome man..Keep providing contents like these.,1
36,I think the Rukmangad Katuwal could also would have been the Dictator back then as he was also seems not the easy and collaborative guy to work with and was biased with Maoist government.,1
37,I have always been searching for analyst or channel talking and analyzing the facts in nepal !! Kudos to your work bro,1
38,Thanks for giving knowledge about history outside of books.,1
